{
  "object_type": "OutcomeEvaluation",
  "evaluation_id": "outcome_eval_connector_degraded_001",
  "evaluation_version": "outcome_evaluator.v1",
  "prediction_id": "prediction_connector_degraded_001",
  "outcome_id": "outcome_connector_degraded_001",
  "candidate_id": "candidate_connector_degraded_001",
  "source_evidence_ref": "artifacts/evidence_connector_degraded_001.json",
  "window": "4h",
  "window_role": "primary_outcome",
  "evaluated_at": "2026-06-16T16:05:00Z",
  "collected_at": "2026-06-16T16:00:00Z",
  "platform": "reddit",
  "metric_map_version": "platform_metrics.v1",
  "threshold_version": "outcome_thresholds.v1",
  "raw_delta": { "likes": 3, "comments": 1, "shares": 0, "views": null },
  "relative_growth": 0.19,
  "platform_normalized_growth": 0.4,
  "author_normalized_growth": null,
  "baseline_status": "author_baseline_missing",
  "confidence_band": "low",
  "outcome_labels": ["raw_growth_observed", "metrics_available", "weak_signal"],
  "success_grade": "not_meaningful",
  "hit": false,
  "calibration_error": 0.22,
  "quality_gates": { "evidence_complete": false, "metrics_available": true, "source_available": true, "not_duplicate": true, "risk_allowed": true, "no_holdout_leakage": true },
  "learning_eligibility": "not_learnable",
  "failure_state": null,
  "input_refs": { "prediction_ref": "artifacts/prediction_connector_degraded_001.json", "outcome_ref": "artifacts/outcome_connector_degraded_001.json", "strategy_version": "strategy.v1", "rule_version": "rulebook.v1" }
}