{
  "object_type": "OutcomeEvaluation",
  "evaluation_id": "outcome_eval_fallback_prediction_001",
  "evaluation_version": "outcome_evaluator.v1",
  "prediction_id": "prediction_fallback_prediction_001",
  "outcome_id": "outcome_fallback_prediction_001",
  "candidate_id": "candidate_fallback_prediction_001",
  "source_evidence_ref": "artifacts/evidence_fallback_prediction_001.json",
  "window": "1h",
  "window_role": "early_momentum",
  "evaluated_at": "2026-06-16T13:05:00Z",
  "collected_at": "2026-06-16T13:00:00Z",
  "platform": "x",
  "metric_map_version": "platform_metrics.v1",
  "threshold_version": "outcome_thresholds.v1",
  "raw_delta": { "likes": 2, "comments": 1, "shares": 0, "views": 30 },
  "relative_growth": 0.375,
  "platform_normalized_growth": 0.625,
  "author_normalized_growth": null,
  "baseline_status": "author_baseline_missing",
  "confidence_band": "low",
  "outcome_labels": ["raw_growth_observed", "metrics_available", "insufficient_denominator", "false_positive"],
  "success_grade": "not_meaningful",
  "hit": false,
  "calibration_error": 0.38,
  "quality_gates": { "evidence_complete": true, "metrics_available": true, "source_available": true, "not_duplicate": true, "risk_allowed": true, "no_holdout_leakage": true },
  "learning_eligibility": "not_learnable",
  "failure_state": null,
  "input_refs": { "prediction_ref": "artifacts/prediction_fallback_prediction_001.json", "outcome_ref": "artifacts/outcome_fallback_prediction_001.json", "strategy_version": "strategy.v1", "rule_version": "rulebook.v1" }
}