{
  "object_type": "OutcomeEvaluation",
  "evaluation_id": "outcome_eval_clean_positive_001",
  "evaluation_version": "outcome_evaluator.v1",
  "prediction_id": "prediction_clean_positive_001",
  "outcome_id": "outcome_clean_positive_001",
  "candidate_id": "candidate_clean_positive_001",
  "source_evidence_ref": "artifacts/evidence_clean_positive_001.json",
  "window": "4h",
  "window_role": "primary_outcome",
  "evaluated_at": "2026-06-16T16:05:00Z",
  "collected_at": "2026-06-16T16:00:00Z",
  "platform": "xueqiu",
  "metric_map_version": "platform_metrics.v1",
  "threshold_version": "outcome_thresholds.v1",
  "raw_delta": { "likes": 18, "comments": 25, "shares": 13, "views": 1700 },
  "relative_growth": 3.63,
  "platform_normalized_growth": 3.0,
  "author_normalized_growth": 3.0,
  "baseline_status": "baseline_ready",
  "confidence_band": "high",
  "outcome_labels": ["raw_growth_observed", "metrics_available", "baseline_normal", "platform_local_lift", "primary_spread_4h"],
  "success_grade": "meaningful",
  "hit": true,
  "calibration_error": 0.08,
  "quality_gates": { "evidence_complete": true, "metrics_available": true, "source_available": true, "not_duplicate": true, "risk_allowed": true, "no_holdout_leakage": true },
  "learning_eligibility": "learn_positive_shadow",
  "failure_state": null,
  "input_refs": { "prediction_ref": "artifacts/prediction_clean_positive_001.json", "outcome_ref": "artifacts/outcome_clean_positive_001.json", "strategy_version": "strategy.v1", "rule_version": "rulebook.v1" }
}